No.     Time           Source                Destination           Protocol Length Info
      1 0.000000000    192.168.1.46          130.225.96.108        TCP      78     52793 > http [SYN] Seq=0 Win=65535 Len=0 MSS=1460 WS=16 TSval=779136793 TSecr=0 SACK_PERM=1

Frame 1: 78 bytes on wire (624 bits), 78 bytes captured (624 bits) on interface 0
Ethernet II, Src: Apple_72:d9:ad (58:b0:35:72:d9:ad), Dst: ZyxelCom_19:a3:47 (fc:f5:28:19:a3:47)
Internet Protocol Version 4, Src: 192.168.1.46 (192.168.1.46), Dst: 130.225.96.108 (130.225.96.108)
Transmission Control Protocol, Src Port: 52793 (52793), Dst Port: http (80), Seq: 0, Len: 0

No.     Time           Source                Destination           Protocol Length Info
      2 0.025529000    130.225.96.108        192.168.1.46          TCP      74     http > 52793 [SYN, ACK] Seq=0 Ack=1 Win=5792 Len=0 MSS=1460 SACK_PERM=1 TSval=1423885601 TSecr=779136793 WS=4

Frame 2: 74 bytes on wire (592 bits), 74 bytes captured (592 bits) on interface 0
Ethernet II, Src: ZyxelCom_19:a3:47 (fc:f5:28:19:a3:47), Dst: Apple_72:d9:ad (58:b0:35:72:d9:ad)
Internet Protocol Version 4, Src: 130.225.96.108 (130.225.96.108), Dst: 192.168.1.46 (192.168.1.46)
Transmission Control Protocol, Src Port: http (80), Dst Port: 52793 (52793), Seq: 0, Ack: 1, Len: 0

No.     Time           Source                Destination           Protocol Length Info
      3 0.025645000    192.168.1.46          130.225.96.108        TCP      66     52793 > http [ACK] Seq=1 Ack=1 Win=131760 Len=0 TSval=779136818 TSecr=1423885601

Frame 3: 66 bytes on wire (528 bits), 66 bytes captured (528 bits) on interface 0
Ethernet II, Src: Apple_72:d9:ad (58:b0:35:72:d9:ad), Dst: ZyxelCom_19:a3:47 (fc:f5:28:19:a3:47)
Internet Protocol Version 4, Src: 192.168.1.46 (192.168.1.46), Dst: 130.225.96.108 (130.225.96.108)
Transmission Control Protocol, Src Port: 52793 (52793), Dst Port: http (80), Seq: 1, Ack: 1, Len: 0

No.     Time           Source                Destination           Protocol Length Info
      4 0.025899000    192.168.1.46          130.225.96.108        HTTP     419    GET / HTTP/1.1 

Frame 4: 419 bytes on wire (3352 bits), 419 bytes captured (3352 bits) on interface 0
Ethernet II, Src: Apple_72:d9:ad (58:b0:35:72:d9:ad), Dst: ZyxelCom_19:a3:47 (fc:f5:28:19:a3:47)
Internet Protocol Version 4, Src: 192.168.1.46 (192.168.1.46), Dst: 130.225.96.108 (130.225.96.108)
Transmission Control Protocol, Src Port: 52793 (52793), Dst Port: http (80), Seq: 1, Ack: 1, Len: 353
Hypertext Transfer Protocol

No.     Time           Source                Destination           Protocol Length Info
      5 0.051161000    130.225.96.108        192.168.1.46          TCP      66     http > 52793 [ACK] Seq=1 Ack=354 Win=6864 Len=0 TSval=1423885608 TSecr=779136818

Frame 5: 66 bytes on wire (528 bits), 66 bytes captured (528 bits) on interface 0
Ethernet II, Src: ZyxelCom_19:a3:47 (fc:f5:28:19:a3:47), Dst: Apple_72:d9:ad (58:b0:35:72:d9:ad)
Internet Protocol Version 4, Src: 130.225.96.108 (130.225.96.108), Dst: 192.168.1.46 (192.168.1.46)
Transmission Control Protocol, Src Port: http (80), Dst Port: 52793 (52793), Seq: 1, Ack: 354, Len: 0

No.     Time           Source                Destination           Protocol Length Info
      6 0.052063000    130.225.96.108        192.168.1.46          HTTP     555    HTTP/1.1 302 Found  (text/html)

Frame 6: 555 bytes on wire (4440 bits), 555 bytes captured (4440 bits) on interface 0
Ethernet II, Src: ZyxelCom_19:a3:47 (fc:f5:28:19:a3:47), Dst: Apple_72:d9:ad (58:b0:35:72:d9:ad)
Internet Protocol Version 4, Src: 130.225.96.108 (130.225.96.108), Dst: 192.168.1.46 (192.168.1.46)
Transmission Control Protocol, Src Port: http (80), Dst Port: 52793 (52793), Seq: 1, Ack: 354, Len: 489
Hypertext Transfer Protocol
Line-based text data: text/html

No.     Time           Source                Destination           Protocol Length Info
      7 0.052190000    192.168.1.46          130.225.96.108        TCP      66     52793 > http [ACK] Seq=354 Ack=490 Win=131264 Len=0 TSval=779136843 TSecr=1423885608

Frame 7: 66 bytes on wire (528 bits), 66 bytes captured (528 bits) on interface 0
Ethernet II, Src: Apple_72:d9:ad (58:b0:35:72:d9:ad), Dst: ZyxelCom_19:a3:47 (fc:f5:28:19:a3:47)
Internet Protocol Version 4, Src: 192.168.1.46 (192.168.1.46), Dst: 130.225.96.108 (130.225.96.108)
Transmission Control Protocol, Src Port: 52793 (52793), Dst Port: http (80), Seq: 354, Ack: 490, Len: 0

No.     Time           Source                Destination           Protocol Length Info
      8 0.056478000    192.168.1.46          130.225.96.108        TCP      78     52794 > http [SYN] Seq=0 Win=65535 Len=0 MSS=1460 WS=16 TSval=779136848 TSecr=0 SACK_PERM=1

Frame 8: 78 bytes on wire (624 bits), 78 bytes captured (624 bits) on interface 0
Ethernet II, Src: Apple_72:d9:ad (58:b0:35:72:d9:ad), Dst: ZyxelCom_19:a3:47 (fc:f5:28:19:a3:47)
Internet Protocol Version 4, Src: 192.168.1.46 (192.168.1.46), Dst: 130.225.96.108 (130.225.96.108)
Transmission Control Protocol, Src Port: 52794 (52794), Dst Port: http (80), Seq: 0, Len: 0

No.     Time           Source                Destination           Protocol Length Info
      9 0.079404000    130.225.96.108        192.168.1.46          TCP      74     http > 52794 [SYN, ACK] Seq=0 Ack=1 Win=5792 Len=0 MSS=1460 SACK_PERM=1 TSval=1423885615 TSecr=779136848 WS=4

Frame 9: 74 bytes on wire (592 bits), 74 bytes captured (592 bits) on interface 0
Ethernet II, Src: ZyxelCom_19:a3:47 (fc:f5:28:19:a3:47), Dst: Apple_72:d9:ad (58:b0:35:72:d9:ad)
Internet Protocol Version 4, Src: 130.225.96.108 (130.225.96.108), Dst: 192.168.1.46 (192.168.1.46)
Transmission Control Protocol, Src Port: http (80), Dst Port: 52794 (52794), Seq: 0, Ack: 1, Len: 0

No.     Time           Source                Destination           Protocol Length Info
     10 0.079485000    192.168.1.46          130.225.96.108        TCP      66     52794 > http [ACK] Seq=1 Ack=1 Win=131760 Len=0 TSval=779136871 TSecr=1423885615

Frame 10: 66 bytes on wire (528 bits), 66 bytes captured (528 bits) on interface 0
Ethernet II, Src: Apple_72:d9:ad (58:b0:35:72:d9:ad), Dst: ZyxelCom_19:a3:47 (fc:f5:28:19:a3:47)
Internet Protocol Version 4, Src: 192.168.1.46 (192.168.1.46), Dst: 130.225.96.108 (130.225.96.108)
Transmission Control Protocol, Src Port: 52794 (52794), Dst Port: http (80), Seq: 1, Ack: 1, Len: 0

No.     Time           Source                Destination           Protocol Length Info
     11 0.079637000    192.168.1.46          130.225.96.108        HTTP     423    GET / HTTP/1.1 

Frame 11: 423 bytes on wire (3384 bits), 423 bytes captured (3384 bits) on interface 0
Ethernet II, Src: Apple_72:d9:ad (58:b0:35:72:d9:ad), Dst: ZyxelCom_19:a3:47 (fc:f5:28:19:a3:47)
Internet Protocol Version 4, Src: 192.168.1.46 (192.168.1.46), Dst: 130.225.96.108 (130.225.96.108)
Transmission Control Protocol, Src Port: 52794 (52794), Dst Port: http (80), Seq: 1, Ack: 1, Len: 357
Hypertext Transfer Protocol

No.     Time           Source                Destination           Protocol Length Info
     12 0.105473000    130.225.96.108        192.168.1.46          TCP      66     http > 52794 [ACK] Seq=1 Ack=358 Win=6864 Len=0 TSval=1423885621 TSecr=779136871

Frame 12: 66 bytes on wire (528 bits), 66 bytes captured (528 bits) on interface 0
Ethernet II, Src: ZyxelCom_19:a3:47 (fc:f5:28:19:a3:47), Dst: Apple_72:d9:ad (58:b0:35:72:d9:ad)
Internet Protocol Version 4, Src: 130.225.96.108 (130.225.96.108), Dst: 192.168.1.46 (192.168.1.46)
Transmission Control Protocol, Src Port: http (80), Dst Port: 52794 (52794), Seq: 1, Ack: 358, Len: 0

No.     Time           Source                Destination           Protocol Length Info
     13 0.120093000    130.225.96.108        192.168.1.46          TCP      1514   [TCP segment of a reassembled PDU]

Frame 13: 1514 bytes on wire (12112 bits), 1514 bytes captured (12112 bits) on interface 0
Ethernet II, Src: ZyxelCom_19:a3:47 (fc:f5:28:19:a3:47), Dst: Apple_72:d9:ad (58:b0:35:72:d9:ad)
Internet Protocol Version 4, Src: 130.225.96.108 (130.225.96.108), Dst: 192.168.1.46 (192.168.1.46)
Transmission Control Protocol, Src Port: http (80), Dst Port: 52794 (52794), Seq: 1, Ack: 358, Len: 1448

No.     Time           Source                Destination           Protocol Length Info
     14 0.121586000    130.225.96.108        192.168.1.46          TCP      1514   [TCP segment of a reassembled PDU]

Frame 14: 1514 bytes on wire (12112 bits), 1514 bytes captured (12112 bits) on interface 0
Ethernet II, Src: ZyxelCom_19:a3:47 (fc:f5:28:19:a3:47), Dst: Apple_72:d9:ad (58:b0:35:72:d9:ad)
Internet Protocol Version 4, Src: 130.225.96.108 (130.225.96.108), Dst: 192.168.1.46 (192.168.1.46)
Transmission Control Protocol, Src Port: http (80), Dst Port: 52794 (52794), Seq: 1449, Ack: 358, Len: 1448

No.     Time           Source                Destination           Protocol Length Info
     15 0.121667000    192.168.1.46          130.225.96.108        TCP      66     52794 > http [ACK] Seq=358 Ack=2897 Win=129616 Len=0 TSval=779136911 TSecr=1423885624

Frame 15: 66 bytes on wire (528 bits), 66 bytes captured (528 bits) on interface 0
Ethernet II, Src: Apple_72:d9:ad (58:b0:35:72:d9:ad), Dst: ZyxelCom_19:a3:47 (fc:f5:28:19:a3:47)
Internet Protocol Version 4, Src: 192.168.1.46 (192.168.1.46), Dst: 130.225.96.108 (130.225.96.108)
Transmission Control Protocol, Src Port: 52794 (52794), Dst Port: http (80), Seq: 358, Ack: 2897, Len: 0

No.     Time           Source                Destination           Protocol Length Info
     16 0.137874000    192.168.1.46          130.225.96.108        TCP      78     52795 > http [SYN] Seq=0 Win=65535 Len=0 MSS=1460 WS=16 TSval=779136927 TSecr=0 SACK_PERM=1

Frame 16: 78 bytes on wire (624 bits), 78 bytes captured (624 bits) on interface 0
Ethernet II, Src: Apple_72:d9:ad (58:b0:35:72:d9:ad), Dst: ZyxelCom_19:a3:47 (fc:f5:28:19:a3:47)
Internet Protocol Version 4, Src: 192.168.1.46 (192.168.1.46), Dst: 130.225.96.108 (130.225.96.108)
Transmission Control Protocol, Src Port: 52795 (52795), Dst Port: http (80), Seq: 0, Len: 0

No.     Time           Source                Destination           Protocol Length Info
     17 0.138857000    192.168.1.46          192.38.110.181        TCP      78     52796 > http [SYN] Seq=0 Win=65535 Len=0 MSS=1460 WS=16 TSval=779136928 TSecr=0 SACK_PERM=1

Frame 17: 78 bytes on wire (624 bits), 78 bytes captured (624 bits) on interface 0
Ethernet II, Src: Apple_72:d9:ad (58:b0:35:72:d9:ad), Dst: ZyxelCom_19:a3:47 (fc:f5:28:19:a3:47)
Internet Protocol Version 4, Src: 192.168.1.46 (192.168.1.46), Dst: 192.38.110.181 (192.38.110.181)
Transmission Control Protocol, Src Port: 52796 (52796), Dst Port: http (80), Seq: 0, Len: 0

No.     Time           Source                Destination           Protocol Length Info
     18 0.138918000    192.168.1.46          192.38.110.181        TCP      78     52797 > http [SYN] Seq=0 Win=65535 Len=0 MSS=1460 WS=16 TSval=779136928 TSecr=0 SACK_PERM=1

Frame 18: 78 bytes on wire (624 bits), 78 bytes captured (624 bits) on interface 0
Ethernet II, Src: Apple_72:d9:ad (58:b0:35:72:d9:ad), Dst: ZyxelCom_19:a3:47 (fc:f5:28:19:a3:47)
Internet Protocol Version 4, Src: 192.168.1.46 (192.168.1.46), Dst: 192.38.110.181 (192.38.110.181)
Transmission Control Protocol, Src Port: 52797 (52797), Dst Port: http (80), Seq: 0, Len: 0

No.     Time           Source                Destination           Protocol Length Info
     19 0.138979000    192.168.1.46          192.38.110.181        TCP      78     52798 > http [SYN] Seq=0 Win=65535 Len=0 MSS=1460 WS=16 TSval=779136928 TSecr=0 SACK_PERM=1

Frame 19: 78 bytes on wire (624 bits), 78 bytes captured (624 bits) on interface 0
Ethernet II, Src: Apple_72:d9:ad (58:b0:35:72:d9:ad), Dst: ZyxelCom_19:a3:47 (fc:f5:28:19:a3:47)
Internet Protocol Version 4, Src: 192.168.1.46 (192.168.1.46), Dst: 192.38.110.181 (192.38.110.181)
Transmission Control Protocol, Src Port: 52798 (52798), Dst Port: http (80), Seq: 0, Len: 0

No.     Time           Source                Destination           Protocol Length Info
     20 0.146252000    130.225.96.108        192.168.1.46          TCP      1514   [TCP segment of a reassembled PDU]

Frame 20: 1514 bytes on wire (12112 bits), 1514 bytes captured (12112 bits) on interface 0
Ethernet II, Src: ZyxelCom_19:a3:47 (fc:f5:28:19:a3:47), Dst: Apple_72:d9:ad (58:b0:35:72:d9:ad)
Internet Protocol Version 4, Src: 130.225.96.108 (130.225.96.108), Dst: 192.168.1.46 (192.168.1.46)
Transmission Control Protocol, Src Port: http (80), Dst Port: 52794 (52794), Seq: 2897, Ack: 358, Len: 1448

No.     Time           Source                Destination           Protocol Length Info
     21 0.147207000    192.168.1.46          130.225.96.108        TCP      66     52794 > http [ACK] Seq=358 Ack=4345 Win=131072 Len=0 TSval=779136935 TSecr=1423885631

Frame 21: 66 bytes on wire (528 bits), 66 bytes captured (528 bits) on interface 0
Ethernet II, Src: Apple_72:d9:ad (58:b0:35:72:d9:ad), Dst: ZyxelCom_19:a3:47 (fc:f5:28:19:a3:47)
Internet Protocol Version 4, Src: 192.168.1.46 (192.168.1.46), Dst: 130.225.96.108 (130.225.96.108)
Transmission Control Protocol, Src Port: 52794 (52794), Dst Port: http (80), Seq: 358, Ack: 4345, Len: 0

No.     Time           Source                Destination           Protocol Length Info
     22 0.148452000    130.225.96.108        192.168.1.46          TCP      1514   [TCP segment of a reassembled PDU]

Frame 22: 1514 bytes on wire (12112 bits), 1514 bytes captured (12112 bits) on interface 0
Ethernet II, Src: ZyxelCom_19:a3:47 (fc:f5:28:19:a3:47), Dst: Apple_72:d9:ad (58:b0:35:72:d9:ad)
Internet Protocol Version 4, Src: 130.225.96.108 (130.225.96.108), Dst: 192.168.1.46 (192.168.1.46)
Transmission Control Protocol, Src Port: http (80), Dst Port: 52794 (52794), Seq: 4345, Ack: 358, Len: 1448

No.     Time           Source                Destination           Protocol Length Info
     23 0.149687000    130.225.96.108        192.168.1.46          TCP      1514   [TCP segment of a reassembled PDU]

Frame 23: 1514 bytes on wire (12112 bits), 1514 bytes captured (12112 bits) on interface 0
Ethernet II, Src: ZyxelCom_19:a3:47 (fc:f5:28:19:a3:47), Dst: Apple_72:d9:ad (58:b0:35:72:d9:ad)
Internet Protocol Version 4, Src: 130.225.96.108 (130.225.96.108), Dst: 192.168.1.46 (192.168.1.46)
Transmission Control Protocol, Src Port: http (80), Dst Port: 52794 (52794), Seq: 5793, Ack: 358, Len: 1448

No.     Time           Source                Destination           Protocol Length Info
     24 0.149789000    192.168.1.46          130.225.96.108        TCP      66     52794 > http [ACK] Seq=358 Ack=7241 Win=129616 Len=0 TSval=779136938 TSecr=1423885631

Frame 24: 66 bytes on wire (528 bits), 66 bytes captured (528 bits) on interface 0
Ethernet II, Src: Apple_72:d9:ad (58:b0:35:72:d9:ad), Dst: ZyxelCom_19:a3:47 (fc:f5:28:19:a3:47)
Internet Protocol Version 4, Src: 192.168.1.46 (192.168.1.46), Dst: 130.225.96.108 (130.225.96.108)
Transmission Control Protocol, Src Port: 52794 (52794), Dst Port: http (80), Seq: 358, Ack: 7241, Len: 0

No.     Time           Source                Destination           Protocol Length Info
     25 0.155433000    192.168.1.46          192.38.110.181        TCP      78     52799 > http [SYN] Seq=0 Win=65535 Len=0 MSS=1460 WS=16 TSval=779136943 TSecr=0 SACK_PERM=1

Frame 25: 78 bytes on wire (624 bits), 78 bytes captured (624 bits) on interface 0
Ethernet II, Src: Apple_72:d9:ad (58:b0:35:72:d9:ad), Dst: ZyxelCom_19:a3:47 (fc:f5:28:19:a3:47)
Internet Protocol Version 4, Src: 192.168.1.46 (192.168.1.46), Dst: 192.38.110.181 (192.38.110.181)
Transmission Control Protocol, Src Port: 52799 (52799), Dst Port: http (80), Seq: 0, Len: 0

No.     Time           Source                Destination           Protocol Length Info
     26 0.155617000    192.168.1.46          192.38.110.181        TCP      78     52800 > http [SYN] Seq=0 Win=65535 Len=0 MSS=1460 WS=16 TSval=779136943 TSecr=0 SACK_PERM=1

Frame 26: 78 bytes on wire (624 bits), 78 bytes captured (624 bits) on interface 0
Ethernet II, Src: Apple_72:d9:ad (58:b0:35:72:d9:ad), Dst: ZyxelCom_19:a3:47 (fc:f5:28:19:a3:47)
Internet Protocol Version 4, Src: 192.168.1.46 (192.168.1.46), Dst: 192.38.110.181 (192.38.110.181)
Transmission Control Protocol, Src Port: 52800 (52800), Dst Port: http (80), Seq: 0, Len: 0

No.     Time           Source                Destination           Protocol Length Info
     27 0.156597000    192.168.1.46          89.150.129.22         DNS      83     Standard query 0x79fa  A googleapis.l.google.com

Frame 27: 83 bytes on wire (664 bits), 83 bytes captured (664 bits) on interface 0
Ethernet II, Src: Apple_72:d9:ad (58:b0:35:72:d9:ad), Dst: ZyxelCom_19:a3:47 (fc:f5:28:19:a3:47)
Internet Protocol Version 4, Src: 192.168.1.46 (192.168.1.46), Dst: 89.150.129.22 (89.150.129.22)
User Datagram Protocol, Src Port: 49487 (49487), Dst Port: domain (53)
Domain Name System (query)

No.     Time           Source                Destination           Protocol Length Info
     28 0.161087000    130.225.96.108        192.168.1.46          TCP      74     http > 52795 [SYN, ACK] Seq=0 Ack=1 Win=5792 Len=0 MSS=1460 SACK_PERM=1 TSval=1423885635 TSecr=779136927 WS=4

Frame 28: 74 bytes on wire (592 bits), 74 bytes captured (592 bits) on interface 0
Ethernet II, Src: ZyxelCom_19:a3:47 (fc:f5:28:19:a3:47), Dst: Apple_72:d9:ad (58:b0:35:72:d9:ad)
Internet Protocol Version 4, Src: 130.225.96.108 (130.225.96.108), Dst: 192.168.1.46 (192.168.1.46)
Transmission Control Protocol, Src Port: http (80), Dst Port: 52795 (52795), Seq: 0, Ack: 1, Len: 0

No.     Time           Source                Destination           Protocol Length Info
     29 0.161194000    192.168.1.46          130.225.96.108        TCP      66     52795 > http [ACK] Seq=1 Ack=1 Win=131760 Len=0 TSval=779136948 TSecr=1423885635

Frame 29: 66 bytes on wire (528 bits), 66 bytes captured (528 bits) on interface 0
Ethernet II, Src: Apple_72:d9:ad (58:b0:35:72:d9:ad), Dst: ZyxelCom_19:a3:47 (fc:f5:28:19:a3:47)
Internet Protocol Version 4, Src: 192.168.1.46 (192.168.1.46), Dst: 130.225.96.108 (130.225.96.108)
Transmission Control Protocol, Src Port: 52795 (52795), Dst Port: http (80), Seq: 1, Ack: 1, Len: 0

No.     Time           Source                Destination           Protocol Length Info
     30 0.161390000    192.168.1.46          130.225.96.108        HTTP     410    GET /css/style.css HTTP/1.1 

Frame 30: 410 bytes on wire (3280 bits), 410 bytes captured (3280 bits) on interface 0
Ethernet II, Src: Apple_72:d9:ad (58:b0:35:72:d9:ad), Dst: ZyxelCom_19:a3:47 (fc:f5:28:19:a3:47)
Internet Protocol Version 4, Src: 192.168.1.46 (192.168.1.46), Dst: 130.225.96.108 (130.225.96.108)
Transmission Control Protocol, Src Port: 52795 (52795), Dst Port: http (80), Seq: 1, Ack: 1, Len: 344
Hypertext Transfer Protocol

No.     Time           Source                Destination           Protocol Length Info
     31 0.163142000    192.38.110.181        192.168.1.46          TCP      74     http > 52796 [SYN, ACK] Seq=0 Ack=1 Win=14480 Len=0 MSS=1380 SACK_PERM=1 TSval=2090510401 TSecr=779136928 WS=128

Frame 31: 74 bytes on wire (592 bits), 74 bytes captured (592 bits) on interface 0
Ethernet II, Src: ZyxelCom_19:a3:47 (fc:f5:28:19:a3:47), Dst: Apple_72:d9:ad (58:b0:35:72:d9:ad)
Internet Protocol Version 4, Src: 192.38.110.181 (192.38.110.181), Dst: 192.168.1.46 (192.168.1.46)
Transmission Control Protocol, Src Port: http (80), Dst Port: 52796 (52796), Seq: 0, Ack: 1, Len: 0

No.     Time           Source                Destination           Protocol Length Info
     32 0.163207000    192.168.1.46          192.38.110.181        TCP      66     52796 > http [ACK] Seq=1 Ack=1 Win=131328 Len=0 TSval=779136950 TSecr=2090510401

Frame 32: 66 bytes on wire (528 bits), 66 bytes captured (528 bits) on interface 0
Ethernet II, Src: Apple_72:d9:ad (58:b0:35:72:d9:ad), Dst: ZyxelCom_19:a3:47 (fc:f5:28:19:a3:47)
Internet Protocol Version 4, Src: 192.168.1.46 (192.168.1.46), Dst: 192.38.110.181 (192.38.110.181)
Transmission Control Protocol, Src Port: 52796 (52796), Dst Port: http (80), Seq: 1, Ack: 1, Len: 0

No.     Time           Source                Destination           Protocol Length Info
     33 0.163344000    192.168.1.46          192.38.110.181        HTTP     412    GET /css/units/nat.css HTTP/1.1 

Frame 33: 412 bytes on wire (3296 bits), 412 bytes captured (3296 bits) on interface 0
Ethernet II, Src: Apple_72:d9:ad (58:b0:35:72:d9:ad), Dst: ZyxelCom_19:a3:47 (fc:f5:28:19:a3:47)
Internet Protocol Version 4, Src: 192.168.1.46 (192.168.1.46), Dst: 192.38.110.181 (192.38.110.181)
Transmission Control Protocol, Src Port: 52796 (52796), Dst Port: http (80), Seq: 1, Ack: 1, Len: 346
Hypertext Transfer Protocol

No.     Time           Source                Destination           Protocol Length Info
     34 0.165280000    192.38.110.181        192.168.1.46          TCP      74     http > 52797 [SYN, ACK] Seq=0 Ack=1 Win=14480 Len=0 MSS=1380 SACK_PERM=1 TSval=2090510402 TSecr=779136928 WS=128

Frame 34: 74 bytes on wire (592 bits), 74 bytes captured (592 bits) on interface 0
Ethernet II, Src: ZyxelCom_19:a3:47 (fc:f5:28:19:a3:47), Dst: Apple_72:d9:ad (58:b0:35:72:d9:ad)
Internet Protocol Version 4, Src: 192.38.110.181 (192.38.110.181), Dst: 192.168.1.46 (192.168.1.46)
Transmission Control Protocol, Src Port: http (80), Dst Port: 52797 (52797), Seq: 0, Ack: 1, Len: 0

No.     Time           Source                Destination           Protocol Length Info
     35 0.165376000    192.168.1.46          192.38.110.181        TCP      66     52797 > http [ACK] Seq=1 Ack=1 Win=131328 Len=0 TSval=779136952 TSecr=2090510402

Frame 35: 66 bytes on wire (528 bits), 66 bytes captured (528 bits) on interface 0
Ethernet II, Src: Apple_72:d9:ad (58:b0:35:72:d9:ad), Dst: ZyxelCom_19:a3:47 (fc:f5:28:19:a3:47)
Internet Protocol Version 4, Src: 192.168.1.46 (192.168.1.46), Dst: 192.38.110.181 (192.38.110.181)
Transmission Control Protocol, Src Port: 52797 (52797), Dst Port: http (80), Seq: 1, Ack: 1, Len: 0

No.     Time           Source                Destination           Protocol Length Info
     36 0.165564000    192.38.110.181        192.168.1.46          TCP      74     http > 52798 [SYN, ACK] Seq=0 Ack=1 Win=14480 Len=0 MSS=1380 SACK_PERM=1 TSval=2090510404 TSecr=779136928 WS=128

Frame 36: 74 bytes on wire (592 bits), 74 bytes captured (592 bits) on interface 0
Ethernet II, Src: ZyxelCom_19:a3:47 (fc:f5:28:19:a3:47), Dst: Apple_72:d9:ad (58:b0:35:72:d9:ad)
Internet Protocol Version 4, Src: 192.38.110.181 (192.38.110.181), Dst: 192.168.1.46 (192.168.1.46)
Transmission Control Protocol, Src Port: http (80), Dst Port: 52798 (52798), Seq: 0, Ack: 1, Len: 0

No.     Time           Source                Destination           Protocol Length Info
     37 0.165575000    192.168.1.46          192.38.110.181        HTTP     403    GET /scripts_js/functions.js HTTP/1.1 

Frame 37: 403 bytes on wire (3224 bits), 403 bytes captured (3224 bits) on interface 0
Ethernet II, Src: Apple_72:d9:ad (58:b0:35:72:d9:ad), Dst: ZyxelCom_19:a3:47 (fc:f5:28:19:a3:47)
Internet Protocol Version 4, Src: 192.168.1.46 (192.168.1.46), Dst: 192.38.110.181 (192.38.110.181)
Transmission Control Protocol, Src Port: 52797 (52797), Dst Port: http (80), Seq: 1, Ack: 1, Len: 337
Hypertext Transfer Protocol

No.     Time           Source                Destination           Protocol Length Info
     38 0.165642000    192.168.1.46          192.38.110.181        TCP      66     52798 > http [ACK] Seq=1 Ack=1 Win=131328 Len=0 TSval=779136952 TSecr=2090510404

Frame 38: 66 bytes on wire (528 bits), 66 bytes captured (528 bits) on interface 0
Ethernet II, Src: Apple_72:d9:ad (58:b0:35:72:d9:ad), Dst: ZyxelCom_19:a3:47 (fc:f5:28:19:a3:47)
Internet Protocol Version 4, Src: 192.168.1.46 (192.168.1.46), Dst: 192.38.110.181 (192.38.110.181)
Transmission Control Protocol, Src Port: 52798 (52798), Dst Port: http (80), Seq: 1, Ack: 1, Len: 0

No.     Time           Source                Destination           Protocol Length Info
     39 0.165922000    192.168.1.46          192.38.110.181        HTTP     401    GET /scripts_js/cookies.js HTTP/1.1 

Frame 39: 401 bytes on wire (3208 bits), 401 bytes captured (3208 bits) on interface 0
Ethernet II, Src: Apple_72:d9:ad (58:b0:35:72:d9:ad), Dst: ZyxelCom_19:a3:47 (fc:f5:28:19:a3:47)
Internet Protocol Version 4, Src: 192.168.1.46 (192.168.1.46), Dst: 192.38.110.181 (192.38.110.181)
Transmission Control Protocol, Src Port: 52798 (52798), Dst Port: http (80), Seq: 1, Ack: 1, Len: 335
Hypertext Transfer Protocol

No.     Time           Source                Destination           Protocol Length Info
     40 0.173279000    130.225.96.108        192.168.1.46          TCP      1514   [TCP segment of a reassembled PDU]

Frame 40: 1514 bytes on wire (12112 bits), 1514 bytes captured (12112 bits) on interface 0
Ethernet II, Src: ZyxelCom_19:a3:47 (fc:f5:28:19:a3:47), Dst: Apple_72:d9:ad (58:b0:35:72:d9:ad)
Internet Protocol Version 4, Src: 130.225.96.108 (130.225.96.108), Dst: 192.168.1.46 (192.168.1.46)
Transmission Control Protocol, Src Port: http (80), Dst Port: 52794 (52794), Seq: 7241, Ack: 358, Len: 1448

No.     Time           Source                Destination           Protocol Length Info
     41 0.173422000    192.168.1.46          130.225.96.108        TCP      66     52794 > http [ACK] Seq=358 Ack=8689 Win=131072 Len=0 TSval=779136960 TSecr=1423885638

Frame 41: 66 bytes on wire (528 bits), 66 bytes captured (528 bits) on interface 0
Ethernet II, Src: Apple_72:d9:ad (58:b0:35:72:d9:ad), Dst: ZyxelCom_19:a3:47 (fc:f5:28:19:a3:47)
Internet Protocol Version 4, Src: 192.168.1.46 (192.168.1.46), Dst: 130.225.96.108 (130.225.96.108)
Transmission Control Protocol, Src Port: 52794 (52794), Dst Port: http (80), Seq: 358, Ack: 8689, Len: 0

No.     Time           Source                Destination           Protocol Length Info
     42 0.174156000    130.225.96.108        192.168.1.46          TCP      1514   [TCP segment of a reassembled PDU]

Frame 42: 1514 bytes on wire (12112 bits), 1514 bytes captured (12112 bits) on interface 0
Ethernet II, Src: ZyxelCom_19:a3:47 (fc:f5:28:19:a3:47), Dst: Apple_72:d9:ad (58:b0:35:72:d9:ad)
Internet Protocol Version 4, Src: 130.225.96.108 (130.225.96.108), Dst: 192.168.1.46 (192.168.1.46)
Transmission Control Protocol, Src Port: http (80), Dst Port: 52794 (52794), Seq: 8689, Ack: 358, Len: 1448

No.     Time           Source                Destination           Protocol Length Info
     43 0.175321000    130.225.96.108        192.168.1.46          TCP      1514   [TCP segment of a reassembled PDU]

Frame 43: 1514 bytes on wire (12112 bits), 1514 bytes captured (12112 bits) on interface 0
Ethernet II, Src: ZyxelCom_19:a3:47 (fc:f5:28:19:a3:47), Dst: Apple_72:d9:ad (58:b0:35:72:d9:ad)
Internet Protocol Version 4, Src: 130.225.96.108 (130.225.96.108), Dst: 192.168.1.46 (192.168.1.46)
Transmission Control Protocol, Src Port: http (80), Dst Port: 52794 (52794), Seq: 10137, Ack: 358, Len: 1448

No.     Time           Source                Destination           Protocol Length Info
     44 0.175372000    192.168.1.46          130.225.96.108        TCP      66     52794 > http [ACK] Seq=358 Ack=11585 Win=129616 Len=0 TSval=779136962 TSecr=1423885638

Frame 44: 66 bytes on wire (528 bits), 66 bytes captured (528 bits) on interface 0
Ethernet II, Src: Apple_72:d9:ad (58:b0:35:72:d9:ad), Dst: ZyxelCom_19:a3:47 (fc:f5:28:19:a3:47)
Internet Protocol Version 4, Src: 192.168.1.46 (192.168.1.46), Dst: 130.225.96.108 (130.225.96.108)
Transmission Control Protocol, Src Port: 52794 (52794), Dst Port: http (80), Seq: 358, Ack: 11585, Len: 0

No.     Time           Source                Destination           Protocol Length Info
     45 0.177120000    130.225.96.108        192.168.1.46          TCP      1514   [TCP segment of a reassembled PDU]

Frame 45: 1514 bytes on wire (12112 bits), 1514 bytes captured (12112 bits) on interface 0
Ethernet II, Src: ZyxelCom_19:a3:47 (fc:f5:28:19:a3:47), Dst: Apple_72:d9:ad (58:b0:35:72:d9:ad)
Internet Protocol Version 4, Src: 130.225.96.108 (130.225.96.108), Dst: 192.168.1.46 (192.168.1.46)
Transmission Control Protocol, Src Port: http (80), Dst Port: 52794 (52794), Seq: 11585, Ack: 358, Len: 1448

No.     Time           Source                Destination           Protocol Length Info
     46 0.177193000    192.168.1.46          130.225.96.108        TCP      66     52794 > http [ACK] Seq=358 Ack=13033 Win=129616 Len=0 TSval=779136963 TSecr=1423885638

Frame 46: 66 bytes on wire (528 bits), 66 bytes captured (528 bits) on interface 0
Ethernet II, Src: Apple_72:d9:ad (58:b0:35:72:d9:ad), Dst: ZyxelCom_19:a3:47 (fc:f5:28:19:a3:47)
Internet Protocol Version 4, Src: 192.168.1.46 (192.168.1.46), Dst: 130.225.96.108 (130.225.96.108)
Transmission Control Protocol, Src Port: 52794 (52794), Dst Port: http (80), Seq: 358, Ack: 13033, Len: 0

No.     Time           Source                Destination           Protocol Length Info
     47 0.178372000    130.225.96.108        192.168.1.46          TCP      1514   [TCP segment of a reassembled PDU]

Frame 47: 1514 bytes on wire (12112 bits), 1514 bytes captured (12112 bits) on interface 0
Ethernet II, Src: ZyxelCom_19:a3:47 (fc:f5:28:19:a3:47), Dst: Apple_72:d9:ad (58:b0:35:72:d9:ad)
Internet Protocol Version 4, Src: 130.225.96.108 (130.225.96.108), Dst: 192.168.1.46 (192.168.1.46)
Transmission Control Protocol, Src Port: http (80), Dst Port: 52794 (52794), Seq: 13033, Ack: 358, Len: 1448

No.     Time           Source                Destination           Protocol Length Info
     48 0.178456000    192.168.1.46          130.225.96.108        TCP      66     52794 > http [ACK] Seq=358 Ack=14481 Win=131072 Len=0 TSval=779136964 TSecr=1423885638

Frame 48: 66 bytes on wire (528 bits), 66 bytes captured (528 bits) on interface 0
Ethernet II, Src: Apple_72:d9:ad (58:b0:35:72:d9:ad), Dst: ZyxelCom_19:a3:47 (fc:f5:28:19:a3:47)
Internet Protocol Version 4, Src: 192.168.1.46 (192.168.1.46), Dst: 130.225.96.108 (130.225.96.108)
Transmission Control Protocol, Src Port: 52794 (52794), Dst Port: http (80), Seq: 358, Ack: 14481, Len: 0

No.     Time           Source                Destination           Protocol Length Info
     49 0.179142000    89.150.129.22         192.168.1.46          DNS      235    Standard query response 0x79fa  A 173.194.71.95

Frame 49: 235 bytes on wire (1880 bits), 235 bytes captured (1880 bits) on interface 0
Ethernet II, Src: ZyxelCom_19:a3:47 (fc:f5:28:19:a3:47), Dst: Apple_72:d9:ad (58:b0:35:72:d9:ad)
Internet Protocol Version 4, Src: 89.150.129.22 (89.150.129.22), Dst: 192.168.1.46 (192.168.1.46)
User Datagram Protocol, Src Port: domain (53), Dst Port: 49487 (49487)
Domain Name System (response)

No.     Time           Source                Destination           Protocol Length Info
     50 0.180519000    192.38.110.181        192.168.1.46          TCP      74     http > 52800 [SYN, ACK] Seq=0 Ack=1 Win=14480 Len=0 MSS=1380 SACK_PERM=1 TSval=2090510420 TSecr=779136943 WS=128

Frame 50: 74 bytes on wire (592 bits), 74 bytes captured (592 bits) on interface 0
Ethernet II, Src: ZyxelCom_19:a3:47 (fc:f5:28:19:a3:47), Dst: Apple_72:d9:ad (58:b0:35:72:d9:ad)
Internet Protocol Version 4, Src: 192.38.110.181 (192.38.110.181), Dst: 192.168.1.46 (192.168.1.46)
Transmission Control Protocol, Src Port: http (80), Dst Port: 52800 (52800), Seq: 0, Ack: 1, Len: 0

No.     Time           Source                Destination           Protocol Length Info
     51 0.180532000    192.168.1.46          173.194.71.95         TCP      78     52801 > http [SYN] Seq=0 Win=65535 Len=0 MSS=1460 WS=16 TSval=779136965 TSecr=0 SACK_PERM=1

Frame 51: 78 bytes on wire (624 bits), 78 bytes captured (624 bits) on interface 0
Ethernet II, Src: Apple_72:d9:ad (58:b0:35:72:d9:ad), Dst: ZyxelCom_19:a3:47 (fc:f5:28:19:a3:47)
Internet Protocol Version 4, Src: 192.168.1.46 (192.168.1.46), Dst: 173.194.71.95 (173.194.71.95)
Transmission Control Protocol, Src Port: 52801 (52801), Dst Port: http (80), Seq: 0, Len: 0

No.     Time           Source                Destination           Protocol Length Info
     52 0.180573000    192.168.1.46          192.38.110.181        TCP      66     52800 > http [ACK] Seq=1 Ack=1 Win=131328 Len=0 TSval=779136965 TSecr=2090510420

Frame 52: 66 bytes on wire (528 bits), 66 bytes captured (528 bits) on interface 0
Ethernet II, Src: Apple_72:d9:ad (58:b0:35:72:d9:ad), Dst: ZyxelCom_19:a3:47 (fc:f5:28:19:a3:47)
Internet Protocol Version 4, Src: 192.168.1.46 (192.168.1.46), Dst: 192.38.110.181 (192.38.110.181)
Transmission Control Protocol, Src Port: 52800 (52800), Dst Port: http (80), Seq: 1, Ack: 1, Len: 0

No.     Time           Source                Destination           Protocol Length Info
     53 0.180730000    192.168.1.46          192.38.110.181        HTTP     412    GET /jquery/1.8.3/jquery-1.8.3.min.js HTTP/1.1 

Frame 53: 412 bytes on wire (3296 bits), 412 bytes captured (3296 bits) on interface 0
Ethernet II, Src: Apple_72:d9:ad (58:b0:35:72:d9:ad), Dst: ZyxelCom_19:a3:47 (fc:f5:28:19:a3:47)
Internet Protocol Version 4, Src: 192.168.1.46 (192.168.1.46), Dst: 192.38.110.181 (192.38.110.181)
Transmission Control Protocol, Src Port: 52800 (52800), Dst Port: http (80), Seq: 1, Ack: 1, Len: 346
Hypertext Transfer Protocol

No.     Time           Source                Destination           Protocol Length Info
     54 0.181106000    192.38.110.181        192.168.1.46          TCP      74     http > 52799 [SYN, ACK] Seq=0 Ack=1 Win=14480 Len=0 MSS=1380 SACK_PERM=1 TSval=2090510419 TSecr=779136943 WS=128

Frame 54: 74 bytes on wire (592 bits), 74 bytes captured (592 bits) on interface 0
Ethernet II, Src: ZyxelCom_19:a3:47 (fc:f5:28:19:a3:47), Dst: Apple_72:d9:ad (58:b0:35:72:d9:ad)
Internet Protocol Version 4, Src: 192.38.110.181 (192.38.110.181), Dst: 192.168.1.46 (192.168.1.46)
Transmission Control Protocol, Src Port: http (80), Dst Port: 52799 (52799), Seq: 0, Ack: 1, Len: 0

No.     Time           Source                Destination           Protocol Length Info
     55 0.181147000    192.168.1.46          192.38.110.181        TCP      66     52799 > http [ACK] Seq=1 Ack=1 Win=131328 Len=0 TSval=779136965 TSecr=2090510419

Frame 55: 66 bytes on wire (528 bits), 66 bytes captured (528 bits) on interface 0
Ethernet II, Src: Apple_72:d9:ad (58:b0:35:72:d9:ad), Dst: ZyxelCom_19:a3:47 (fc:f5:28:19:a3:47)
Internet Protocol Version 4, Src: 192.168.1.46 (192.168.1.46), Dst: 192.38.110.181 (192.38.110.181)
Transmission Control Protocol, Src Port: 52799 (52799), Dst Port: http (80), Seq: 1, Ack: 1, Len: 0

No.     Time           Source                Destination           Protocol Length Info
     56 0.181287000    192.168.1.46          192.38.110.181        HTTP     407    GET /jquery/jquery-ku-faelles.js HTTP/1.1 

Frame 56: 407 bytes on wire (3256 bits), 407 bytes captured (3256 bits) on interface 0
Ethernet II, Src: Apple_72:d9:ad (58:b0:35:72:d9:ad), Dst: ZyxelCom_19:a3:47 (fc:f5:28:19:a3:47)
Internet Protocol Version 4, Src: 192.168.1.46 (192.168.1.46), Dst: 192.38.110.181 (192.38.110.181)
Transmission Control Protocol, Src Port: 52799 (52799), Dst Port: http (80), Seq: 1, Ack: 1, Len: 341
Hypertext Transfer Protocol

No.     Time           Source                Destination           Protocol Length Info
     57 0.186938000    130.225.96.108        192.168.1.46          TCP      66     http > 52795 [ACK] Seq=1 Ack=345 Win=6864 Len=0 TSval=1423885642 TSecr=779136948

Frame 57: 66 bytes on wire (528 bits), 66 bytes captured (528 bits) on interface 0
Ethernet II, Src: ZyxelCom_19:a3:47 (fc:f5:28:19:a3:47), Dst: Apple_72:d9:ad (58:b0:35:72:d9:ad)
Internet Protocol Version 4, Src: 130.225.96.108 (130.225.96.108), Dst: 192.168.1.46 (192.168.1.46)
Transmission Control Protocol, Src Port: http (80), Dst Port: 52795 (52795), Seq: 1, Ack: 345, Len: 0

No.     Time           Source                Destination           Protocol Length Info
     58 0.189947000    192.38.110.181        192.168.1.46          TCP      66     http > 52796 [ACK] Seq=1 Ack=347 Win=15616 Len=0 TSval=2090510429 TSecr=779136950

Frame 58: 66 bytes on wire (528 bits), 66 bytes captured (528 bits) on interface 0
Ethernet II, Src: ZyxelCom_19:a3:47 (fc:f5:28:19:a3:47), Dst: Apple_72:d9:ad (58:b0:35:72:d9:ad)
Internet Protocol Version 4, Src: 192.38.110.181 (192.38.110.181), Dst: 192.168.1.46 (192.168.1.46)
Transmission Control Protocol, Src Port: http (80), Dst Port: 52796 (52796), Seq: 1, Ack: 347, Len: 0

No.     Time           Source                Destination           Protocol Length Info
     59 0.191956000    192.38.110.181        192.168.1.46          TCP      66     http > 52797 [ACK] Seq=1 Ack=338 Win=15616 Len=0 TSval=2090510431 TSecr=779136952

Frame 59: 66 bytes on wire (528 bits), 66 bytes captured (528 bits) on interface 0
Ethernet II, Src: ZyxelCom_19:a3:47 (fc:f5:28:19:a3:47), Dst: Apple_72:d9:ad (58:b0:35:72:d9:ad)
Internet Protocol Version 4, Src: 192.38.110.181 (192.38.110.181), Dst: 192.168.1.46 (192.168.1.46)
Transmission Control Protocol, Src Port: http (80), Dst Port: 52797 (52797), Seq: 1, Ack: 338, Len: 0

No.     Time           Source                Destination           Protocol Length Info
     60 0.196899000    192.38.110.181        192.168.1.46          TCP      1434   [TCP segment of a reassembled PDU]

Frame 60: 1434 bytes on wire (11472 bits), 1434 bytes captured (11472 bits) on interface 0
Ethernet II, Src: ZyxelCom_19:a3:47 (fc:f5:28:19:a3:47), Dst: Apple_72:d9:ad (58:b0:35:72:d9:ad)
Internet Protocol Version 4, Src: 192.38.110.181 (192.38.110.181), Dst: 192.168.1.46 (192.168.1.46)
Transmission Control Protocol, Src Port: http (80), Dst Port: 52796 (52796), Seq: 1, Ack: 347, Len: 1368

No.     Time           Source                Destination           Protocol Length Info
     61 0.197425000    192.38.110.181        192.168.1.46          HTTP     972    HTTP/1.1 200 OK  (text/css)

Frame 61: 972 bytes on wire (7776 bits), 972 bytes captured (7776 bits) on interface 0
Ethernet II, Src: ZyxelCom_19:a3:47 (fc:f5:28:19:a3:47), Dst: Apple_72:d9:ad (58:b0:35:72:d9:ad)
Internet Protocol Version 4, Src: 192.38.110.181 (192.38.110.181), Dst: 192.168.1.46 (192.168.1.46)
Transmission Control Protocol, Src Port: http (80), Dst Port: 52796 (52796), Seq: 1369, Ack: 347, Len: 906
[2 Reassembled TCP Segments (2274 bytes): #60(1368), #61(906)]
Hypertext Transfer Protocol
Line-based text data: text/css

No.     Time           Source                Destination           Protocol Length Info
     62 0.197492000    192.168.1.46          192.38.110.181        TCP      66     52796 > http [ACK] Seq=347 Ack=2275 Win=130160 Len=0 TSval=779136979 TSecr=2090510434

Frame 62: 66 bytes on wire (528 bits), 66 bytes captured (528 bits) on interface 0
Ethernet II, Src: Apple_72:d9:ad (58:b0:35:72:d9:ad), Dst: ZyxelCom_19:a3:47 (fc:f5:28:19:a3:47)
Internet Protocol Version 4, Src: 192.168.1.46 (192.168.1.46), Dst: 192.38.110.181 (192.38.110.181)
Transmission Control Protocol, Src Port: 52796 (52796), Dst Port: http (80), Seq: 347, Ack: 2275, Len: 0

No.     Time           Source                Destination           Protocol Length Info
     63 0.197771000    192.38.110.181        192.168.1.46          TCP      66     http > 52796 [FIN, ACK] Seq=2275 Ack=347 Win=15616 Len=0 TSval=2090510434 TSecr=779136950

Frame 63: 66 bytes on wire (528 bits), 66 bytes captured (528 bits) on interface 0
Ethernet II, Src: ZyxelCom_19:a3:47 (fc:f5:28:19:a3:47), Dst: Apple_72:d9:ad (58:b0:35:72:d9:ad)
Internet Protocol Version 4, Src: 192.38.110.181 (192.38.110.181), Dst: 192.168.1.46 (192.168.1.46)
Transmission Control Protocol, Src Port: http (80), Dst Port: 52796 (52796), Seq: 2275, Ack: 347, Len: 0

No.     Time           Source                Destination           Protocol Length Info
